{
  "command": "email validate",
  "data": {
    "schema_id": "lead-code-synth-research.email.planning-cycle-start",
    "valid": true
  },
  "diagnostics": [],
  "loop_slug": "lead-code-synth-research",
  "plan_revision": "harness-stage-0001",
  "run_id": "run-20260604T053237Z",
  "success": true,
  "warnings": []
}
